{
  "schema_version": "pba.pqc.reference-qualification-catalog.v1",
  "status": "development_reference_not_enterprise_selection",
  "taxonomy_note": "Employer-neutral engineering crosswalk. Counts describe this reference catalog, not enterprise coverage, deployed adapters or a claim that every migration is currently supported.",
  "examples_status": "recognition_examples_not_installed_or_selected",
  "estate_areas": [
    {
      "id": "area-01",
      "name": "Enterprise context"
    },
    {
      "id": "area-02",
      "name": "PKI and trust"
    },
    {
      "id": "area-03",
      "name": "Encrypted traffic"
    },
    {
      "id": "area-04",
      "name": "Machine access"
    },
    {
      "id": "area-05",
      "name": "Software delivery"
    },
    {
      "id": "area-06",
      "name": "Cloud, keys and identity"
    },
    {
      "id": "area-07",
      "name": "Protected data"
    },
    {
      "id": "area-08",
      "name": "Distributed endpoints"
    },
    {
      "id": "area-09",
      "name": "Specialized and regulated cryptography"
    },
    {
      "id": "area-10",
      "name": "Governance and assurance"
    }
  ],
  "source_families": [
    {
      "id": "cmdb",
      "area_ref": "area-01",
      "name": "Configuration and service records",
      "recognition_examples": [
        "ServiceNow CMDB",
        "BMC Helix CMDB"
      ],
      "discovery_question": "Which system of record identifies configuration and service records and its accountable owner? These are recognition examples, not selections.",
      "evidence_targets": [
        "application identities",
        "service relationships",
        "accountable owners",
        "criticality"
      ],
      "pattern_refs": [
        "tls-hybrid-key-exchange",
        "ssh-hybrid-key-exchange"
      ],
      "product_profile": {
        "status": "unknown_requires_owner_and_vendor_confirmation",
        "product": null,
        "edition": null,
        "version": null,
        "instance": null,
        "approved_interface": null,
        "authentication": null,
        "minimum_permissions": null,
        "licensing": null,
        "pagination": null,
        "deletion_semantics": null,
        "rate_limits": null,
        "write_idempotency": null
      }
    },
    {
      "id": "application-portfolio",
      "area_ref": "area-01",
      "name": "Application portfolio",
      "recognition_examples": [
        "SAP LeanIX",
        "ServiceNow APM"
      ],
      "discovery_question": "Which system of record identifies application portfolio and its accountable owner? These are recognition examples, not selections.",
      "evidence_targets": [
        "application lifecycle",
        "business services",
        "owner routes"
      ],
      "pattern_refs": [
        "tls-hybrid-key-exchange",
        "application-library-migration",
        "vendor-product-transition"
      ],
      "product_profile": {
        "status": "unknown_requires_owner_and_vendor_confirmation",
        "product": null,
        "edition": null,
        "version": null,
        "instance": null,
        "approved_interface": null,
        "authentication": null,
        "minimum_permissions": null,
        "licensing": null,
        "pagination": null,
        "deletion_semantics": null,
        "rate_limits": null,
        "write_idempotency": null
      }
    },
    {
      "id": "certificate-lifecycle",
      "area_ref": "area-02",
      "name": "Certificate lifecycle platforms",
      "recognition_examples": [
        "Venafi",
        "DigiCert Trust Lifecycle Manager"
      ],
      "discovery_question": "Which system of record identifies certificate lifecycle platforms and its accountable owner? These are recognition examples, not selections.",
      "evidence_targets": [
        "certificate metadata",
        "deployment associations",
        "renewal policies"
      ],
      "pattern_refs": [
        "tls-hybrid-key-exchange",
        "certificate-signature-migration",
        "message-protection"
      ],
      "product_profile": {
        "status": "unknown_requires_owner_and_vendor_confirmation",
        "product": null,
        "edition": null,
        "version": null,
        "instance": null,
        "approved_interface": null,
        "authentication": null,
        "minimum_permissions": null,
        "licensing": null,
        "pagination": null,
        "deletion_semantics": null,
        "rate_limits": null,
        "write_idempotency": null
      }
    },
    {
      "id": "certificate-authorities",
      "area_ref": "area-02",
      "name": "Certificate authorities and trust stores",
      "recognition_examples": [
        "Microsoft AD CS",
        "EJBCA",
        "OpenSSL"
      ],
      "discovery_question": "Which system of record identifies certificate authorities and trust stores and its accountable owner? These are recognition examples, not selections.",
      "evidence_targets": [
        "issuance profiles",
        "trust anchors",
        "relying-party configuration"
      ],
      "pattern_refs": [
        "tls-hybrid-key-exchange",
        "certificate-signature-migration",
        "trust-distribution"
      ],
      "product_profile": {
        "status": "unknown_requires_owner_and_vendor_confirmation",
        "product": null,
        "edition": null,
        "version": null,
        "instance": null,
        "approved_interface": null,
        "authentication": null,
        "minimum_permissions": null,
        "licensing": null,
        "pagination": null,
        "deletion_semantics": null,
        "rate_limits": null,
        "write_idempotency": null
      }
    },
    {
      "id": "hsm",
      "area_ref": "area-02",
      "name": "Hardware cryptographic modules",
      "recognition_examples": [
        "Thales Luna",
        "Entrust nShield"
      ],
      "discovery_question": "Which system of record identifies hardware cryptographic modules and its accountable owner? These are recognition examples, not selections.",
      "evidence_targets": [
        "module versions",
        "supported mechanisms",
        "key custody references"
      ],
      "pattern_refs": [
        "certificate-signature-migration",
        "code-signing",
        "hsm-capability-upgrade",
        "specialist-ceremony"
      ],
      "product_profile": {
        "status": "unknown_requires_owner_and_vendor_confirmation",
        "product": null,
        "edition": null,
        "version": null,
        "instance": null,
        "approved_interface": null,
        "authentication": null,
        "minimum_permissions": null,
        "licensing": null,
        "pagination": null,
        "deletion_semantics": null,
        "rate_limits": null,
        "write_idempotency": null
      }
    },
    {
      "id": "traffic-termination",
      "area_ref": "area-03",
      "name": "Load balancers and TLS proxies",
      "recognition_examples": [
        "F5 BIG-IP",
        "HAProxy",
        "NGINX"
      ],
      "discovery_question": "Which system of record identifies load balancers and tls proxies and its accountable owner? These are recognition examples, not selections.",
      "evidence_targets": [
        "listeners",
        "protocol configuration",
        "client compatibility"
      ],
      "pattern_refs": [
        "tls-hybrid-key-exchange"
      ],
      "product_profile": {
        "status": "unknown_requires_owner_and_vendor_confirmation",
        "product": null,
        "edition": null,
        "version": null,
        "instance": null,
        "approved_interface": null,
        "authentication": null,
        "minimum_permissions": null,
        "licensing": null,
        "pagination": null,
        "deletion_semantics": null,
        "rate_limits": null,
        "write_idempotency": null
      }
    },
    {
      "id": "api-and-mesh",
      "area_ref": "area-03",
      "name": "API gateways and service meshes",
      "recognition_examples": [
        "Kong",
        "Apigee",
        "Istio"
      ],
      "discovery_question": "Which system of record identifies api gateways and service meshes and its accountable owner? These are recognition examples, not selections.",
      "evidence_targets": [
        "service routes",
        "workload certificates",
        "transport policy"
      ],
      "pattern_refs": [
        "tls-hybrid-key-exchange",
        "certificate-signature-migration",
        "identity-token-signing",
        "workload-credential"
      ],
      "product_profile": {
        "status": "unknown_requires_owner_and_vendor_confirmation",
        "product": null,
        "edition": null,
        "version": null,
        "instance": null,
        "approved_interface": null,
        "authentication": null,
        "minimum_permissions": null,
        "licensing": null,
        "pagination": null,
        "deletion_semantics": null,
        "rate_limits": null,
        "write_idempotency": null
      }
    },
    {
      "id": "network-telemetry",
      "area_ref": "area-03",
      "name": "Network observation platforms",
      "recognition_examples": [
        "Zeek",
        "Wireshark"
      ],
      "discovery_question": "Which system of record identifies network observation platforms and its accountable owner? These are recognition examples, not selections.",
      "evidence_targets": [
        "observed handshakes",
        "observation boundaries",
        "traffic coverage"
      ],
      "pattern_refs": [
        "tls-hybrid-key-exchange",
        "vpn-key-exchange",
        "dnssec"
      ],
      "product_profile": {
        "status": "unknown_requires_owner_and_vendor_confirmation",
        "product": null,
        "edition": null,
        "version": null,
        "instance": null,
        "approved_interface": null,
        "authentication": null,
        "minimum_permissions": null,
        "licensing": null,
        "pagination": null,
        "deletion_semantics": null,